id,title,city,category,address,organizer,date,description,image_url,url
1,Fintone,SPB,COMMON,47153 Barnett Place,Eare,2017-02-22 10:08:51,imperdiet et commodo vulputate justo in blandit ultrices enim lorem ipsum dolor sit,http://static.snopes.com/wordpress/wp-content/uploads/2016/02/tesla.jpg,http://ideanomics.ru/articles/8278
2,Alpha,MOSCOW,COMMON,32 Northview Center,Skinte,2017-02-23 11:35:56,pede ullamcorper augue a suscipit nulla elit ac nulla sed,http://static.snopes.com/wordpress/wp-content/uploads/2016/02/tesla.jpg,http://ideanomics.ru/articles/8278
3,Home Ing,KZN,COMMON,81487 Menomonie Lane,Oyoba,2017-02-21 08:21:15,enim in tempor turpis nec euismod scelerisque quam turpis adipiscing lorem vitae mattis nibh ligula,http://static.snopes.com/wordpress/wp-content/uploads/2016/02/tesla.jpg,http://ideanomics.ru/articles/8278
4,Veribet,MOSCOW,COMMON,9916 Anniversary Road,Fatz,2017-02-23 13:38:57,aliquet maecenas leo odio condimentum id luctus nec molestie sed justo pellentesque viverra pede ac diam cras pellentesque volutpat,http://static.snopes.com/wordpress/wp-content/uploads/2016/02/tesla.jpg,http://ideanomics.ru/articles/8278
5,Konklux,EKB,COMMON,0218 Aberg Crossing,Voonyx,2017-02-20 02:16:59,nullam molestie nibh in lectus pellentesque at nulla suspendisse potenti cras in,http://static.snopes.com/wordpress/wp-content/uploads/2016/02/tesla.jpg,http://ideanomics.ru/articles/8278
6,Sonair,MOSCOW,COMMON,83 Mesta Pass,Fadeo,2017-02-19 17:05:45,suscipit ligula in lacus curabitur at ipsum ac tellus semper interdum mauris ullamcorper,http://static.snopes.com/wordpress/wp-content/uploads/2016/02/tesla.jpg,http://ideanomics.ru/articles/8278
7,Prodder,SPB,COMMON,32070 Ohio Drive,Skyba,2017-02-23 03:09:40,aliquam convallis nunc proin at turpis a pede posuere nonummy integer non velit,http://static.snopes.com/wordpress/wp-content/uploads/2016/02/tesla.jpg,http://ideanomics.ru/articles/8278
8,Kanlam,MOSCOW,COMMON,8 Bobwhite Road,Thoughtstorm,2017-02-23 14:16:55,sed vestibulum sit amet cursus id turpis integer aliquet massa id lobortis convallis tortor risus dapibus augue,http://static.snopes.com/wordpress/wp-content/uploads/2016/02/tesla.jpg,http://ideanomics.ru/articles/8278
9,Sonsing,KZN,COMMON,5 Burning Wood Drive,Riffpedia,2017-02-20 12:34:52,aenean lectus pellentesque eget nunc donec quis orci eget orci vehicula condimentum curabitur in libero ut massa volutpat convallis morbi,http://static.snopes.com/wordpress/wp-content/uploads/2016/02/tesla.jpg,http://ideanomics.ru/articles/8278
10,Job,MOSCOW,TOP,9 Alpine Trail,Mybuzz,2017-02-20 12:59:02,habitasse platea dictumst etiam faucibus cursus urna ut tellus nulla ut,http://static.snopes.com/wordpress/wp-content/uploads/2016/02/tesla.jpg,http://ideanomics.ru/articles/8278
11,Sonsing,SPB,COMMON,6 Alpine Hill,Oyonder,2017-02-18 05:02:33,non mi integer ac neque duis bibendum morbi non quam nec dui luctus rutrum nulla tellus,http://static.snopes.com/wordpress/wp-content/uploads/2016/02/tesla.jpg,http://ideanomics.ru/articles/8278
12,Keylex,MOSCOW,COMMON,6161 Bluejay Alley,Livetube,2017-02-22 12:39:38,primis in faucibus orci luctus et ultrices posuere cubilia curae donec pharetra magna vestibulum,http://static.snopes.com/wordpress/wp-content/uploads/2016/02/tesla.jpg,http://ideanomics.ru/articles/8278
13,Opela,SPB,COMMON,6 Killdeer Street,Quaxo,2017-02-22 02:51:55,cursus urna ut tellus nulla ut erat id mauris vulputate elementum nullam,http://static.snopes.com/wordpress/wp-content/uploads/2016/02/tesla.jpg,http://ideanomics.ru/articles/8278
14,Bitchip,MOSCOW,COMMON,78 Emmet Junction,Oyonder,2017-02-19 01:23:04,vivamus in felis eu sapien cursus vestibulum proin eu mi nulla ac enim in,http://static.snopes.com/wordpress/wp-content/uploads/2016/02/tesla.jpg,http://ideanomics.ru/articles/8278
15,Fix San,KZN,COMMON,49 Westend Place,Yadel,2017-02-17 01:51:58,at vulputate vitae nisl aenean lectus pellentesque eget nunc donec quis orci,http://static.snopes.com/wordpress/wp-content/uploads/2016/02/tesla.jpg,http://ideanomics.ru/articles/8278
16,Bamity,MOSCOW,COMMON,218 Crest Line Court,Layo,2017-02-19 03:03:46,sit amet sem fusce consequat nulla nisl nunc nisl duis bibendum felis sed interdum venenatis turpis enim,http://static.snopes.com/wordpress/wp-content/uploads/2016/02/tesla.jpg,http://ideanomics.ru/articles/8278
17,Sonsing,SPB,COMMON,9 Northview Crossing,Avamm,2017-02-18 15:08:40,ut volutpat sapien arcu sed augue aliquam erat volutpat in congue etiam justo,http://static.snopes.com/wordpress/wp-content/uploads/2016/02/tesla.jpg,http://ideanomics.ru/articles/8278
18,Asoka,MOSCOW,COMMON,3 Acker Alley,Skipfire,2017-02-23 19:30:51,tortor duis mattis egestas metus aenean fermentum donec ut mauris eget massa tempor convallis nulla,http://static.snopes.com/wordpress/wp-content/uploads/2016/02/tesla.jpg,http://ideanomics.ru/articles/8278
19,Temp,SPB,COMMON,725 Crest Line Park,Jatri,2017-02-18 10:52:04,justo sit amet sapien dignissim vestibulum vestibulum ante ipsum primis,http://static.snopes.com/wordpress/wp-content/uploads/2016/02/tesla.jpg,http://ideanomics.ru/articles/8278
20,Lotlux,MOSCOW,TOP,7 Upham Plaza,Topiclounge,2017-02-21 19:21:40,rhoncus mauris enim leo rhoncus sed vestibulum sit amet cursus id turpis integer aliquet massa,http://static.snopes.com/wordpress/wp-content/uploads/2016/02/tesla.jpg,http://ideanomics.ru/articles/8278
21,Opela,KZN,COMMON,3482 East Circle,Skaboo,2017-02-18 12:01:32,enim sit amet nunc viverra dapibus nulla suscipit ligula in,http://static.snopes.com/wordpress/wp-content/uploads/2016/02/tesla.jpg,http://ideanomics.ru/articles/8278
22,Subin,MOSCOW,COMMON,75761 Blaine Trail,Blogpad,2017-02-22 08:13:21,lorem vitae mattis nibh ligula nec sem duis aliquam convallis nunc proin at turpis a pede,http://static.snopes.com/wordpress/wp-content/uploads/2016/02/tesla.jpg,http://ideanomics.ru/articles/8278
23,Flexidy,SPB,COMMON,48 Dawn Lane,Jabbertype,2017-02-19 10:07:12,sit amet lobortis sapien sapien non mi integer ac neque duis bibendum morbi non quam,http://static.snopes.com/wordpress/wp-content/uploads/2016/02/tesla.jpg,http://ideanomics.ru/articles/8278
24,Gembucket,MOSCOW,COMMON,31811 Briar Crest Place,Browsebug,2017-02-17 12:36:04,lorem ipsum dolor sit amet consectetuer adipiscing elit proin interdum mauris non ligula pellentesque ultrices,http://static.snopes.com/wordpress/wp-content/uploads/2016/02/tesla.jpg,http://ideanomics.ru/articles/8278
25,Flexidy,EKB,COMMON,0327 Linden Road,Gigabox,2017-02-17 23:30:52,consequat metus sapien ut nunc vestibulum ante ipsum primis in faucibus orci luctus et ultrices posuere,http://static.snopes.com/wordpress/wp-content/uploads/2016/02/tesla.jpg,http://ideanomics.ru/articles/8278
26,Opela,MOSCOW,COMMON,9876 Summerview Terrace,Thoughtblab,2017-02-20 18:44:40,suspendisse accumsan tortor quis turpis sed ante vivamus tortor duis mattis egestas metus aenean fermentum donec ut mauris eget,http://static.snopes.com/wordpress/wp-content/uploads/2016/02/tesla.jpg,http://ideanomics.ru/articles/8278
27,Job,KZN,COMMON,0690 Veith Way,Flipstorm,2017-02-21 18:36:05,suscipit nulla elit ac nulla sed vel enim sit amet nunc viverra,http://static.snopes.com/wordpress/wp-content/uploads/2016/02/tesla.jpg,http://ideanomics.ru/articles/8278
28,Regrant,MOSCOW,COMMON,44 Sunnyside Trail,Topicblab,2017-02-18 15:11:53,et commodo vulputate justo in blandit ultrices enim lorem ipsum dolor sit amet consectetuer adipiscing elit proin,http://static.snopes.com/wordpress/wp-content/uploads/2016/02/tesla.jpg,http://ideanomics.ru/articles/8278
29,Holdlamis,SPB,COMMON,454 Alpine Street,InnoZ,2017-02-20 04:25:46,lorem vitae mattis nibh ligula nec sem duis aliquam convallis nunc proin at turpis,http://static.snopes.com/wordpress/wp-content/uploads/2016/02/tesla.jpg,http://ideanomics.ru/articles/8278
30,Rank,MOSCOW,TOP,307 Blaine Court,Quatz,2017-02-17 13:11:43,vitae quam suspendisse potenti nullam porttitor lacus at turpis donec posuere metus vitae,http://static.snopes.com/wordpress/wp-content/uploads/2016/02/tesla.jpg,http://ideanomics.ru/articles/8278
